<?xml version="1.0" encoding="UTF-8" ?>
<configuration xmlns="http://age.iisg.agh.edu.pl/schema/age" xmlns:xsi="http://www.w3.org/2001/XMLSchema-instance"
               xsi:schemaLocation="http://age.iisg.agh.edu.pl/schema/age http://age.iisg.agh.edu.pl/schema/age/age.xsd">

	<!-- System which contains 3 PropertiesSimpleAgents which: - uses strategy
		functionCounter to compute square sum of two numbers (x & y) - randomly watch
		neighbors and writes them properties to console SimpleFunctionCounter contract
		is read from XML file SimpleFunctionCounter.contract.xml. -->

	<include file="classpath:examples/common.xml">
		<block name="workplaces">
			<component name="workplace" class="org.jage.workplace.SimpleWorkplace" isSingleton="false">
				<property name="agent">
					<agent name="action" class="org.jage.agent.SimpleAggregate">
						<component class="org.jage.address.agent.DefaultAgentAddressSupplier">
							<constructor-arg name="nameTemplate" value="TheXFiles"/>
						</component>

						<strategy name="functionCounter1"
						          class="org.jage.examples.properties.xml.SimpleFunctionCounter">
							<property name="x" type="Integer" value="1"/>
							<property name="y" type="Integer" value="2"/>
						</strategy>
						<strategy name="functionCounter2"
						          class="org.jage.examples.properties.xml.SimpleFunctionCounter">
							<property name="x" type="Integer" value="10"/>
							<property name="y" type="Integer" value="20"/>
						</strategy>
						<strategy name="functionCounter3"
						          class="org.jage.examples.properties.xml.SimpleFunctionCounter">
							<property name="x" type="Integer" value="100"/>
							<property name="y" type="Integer" value="200"/>
						</strategy>

						<property name="agents">
							<list>
								<agent name="scully" class="org.jage.examples.properties.xml.PropertiesSimpleAgent">
									<component class="org.jage.address.agent.DefaultAgentAddressSupplier">
										<constructor-arg name="nameTemplate" value="Scully"/>
									</component>
									<property name="actor" value="Gillian Anderson"/>
									<property name="functionCounter" ref="functionCounter1"/>
								</agent>
								<agent name="mulder" class="org.jage.examples.properties.xml.PropertiesSimpleAgent">
									<component class="org.jage.address.agent.DefaultAgentAddressSupplier">
										<constructor-arg name="nameTemplate" value="Mulder"/>
									</component>
									<property name="actor" value="David Duchovny"/>
									<property name="functionCounter" ref="functionCounter2"/>
								</agent>
								<agent name="skinner" class="org.jage.examples.properties.xml.PropertiesSimpleAgent">
									<component class="org.jage.address.agent.DefaultAgentAddressSupplier">
										<constructor-arg name="nameTemplate" value="Skinner"/>
									</component>
									<property name="actor" value="Mitch Pileggi"/>
									<property name="functionCounter" ref="functionCounter3"/>
								</agent>
							</list>
						</property>
					</agent>
				</property>
			</component>
		</block>
	</include>
</configuration>
