<?xml version="1.0" encoding="UTF-8" ?>
<configuration xmlns:xsi="http://www.w3.org/2001/XMLSchema-instance"
               xmlns="http://age.iisg.agh.edu.pl/schema/age"
               xsi:schemaLocation="http://age.iisg.agh.edu.pl/schema/age http://age.iisg.agh.edu.pl/schema/age/age.xsd">

    <component class="org.jage.communication.HazelcastCommunicationManager"/>
    <component class="org.jage.configuration.service.ConfigurationStorageService"/>
    <component class="org.jage.configuration.service.ConfigurationLoaderService"/>
    <component class="org.jage.bus.EventBus">
        <constructor-arg name="name" type="String" value="mainBus"/>
    </component>

    <component name="workplaceManager"
               class="org.jage.workplace.manager.DefaultWorkplaceManager"/>

    <component class="org.jage.lifecycle.AutoExitHook"/>

</configuration>
